journal,indexation,publication,doi,titre,chercheurs,laboratoires,abstract,keywords,pays,quartile
,IEEE,Publisher: IEEE,DOI: 10.1109/ACCESS.2022.3154776,Personas for Artificial Intelligence (AI) an Open Source Toolbox,Andreas Holzinger; Michaela Kargl; Bettina Kipperer; Peter Regitnig; Markus Plass; Heimo Müller,,"Personas have successfully supported the development of classical user interfaces for more than two decades by mapping users’ mental models to specific contexts. The rapid proliferation of Artificial Intelligence (AI) applications makes it necessary to create new approaches for future human-AI interfaces. Human-AI interfaces differ from classical human-computer interfaces in many ways, such as gaining some degree of human-like cognitive, self-executing, and self-adaptive capabilities and autonomy, and generating unexpected outputs that require non-deterministic interactions. Moreover, the most successful AI approaches are so-called “black box” systems, where the technology and the machine learning process are opaque to the user and the AI output is far not intuitive. This work shows how the personas method can be adapted to support the development of human-centered AI applications, and we demonstrate this on the example of a medical context. This work is - to our knowledge - the first to provide personas for AI using an openly available Personas for AI toolbox . The toolbox contains guidelines and material supporting persona development for AI as well as templates and pictures for persona visualisation. It is ready to use and freely available to the international research and development community. Additionally, an example from medical AI is provided as a best practice use case. This work is intended to help foster the development of novel human-AI interfaces that will be urgently needed in the near future.",,,
,IEEE,Publisher: MIT Press,DOI: 10.7551/mitpress/12350.001.0001,II THE PROSPECTS AND LIMITS OF AI,Peter Dauvergne,,,,,
,IEEE,Publisher: IET,,IEE Colloquium on 'AI in Medical Decision Making' (Digest No.062),,,,,,
,IEEE,Publisher: MIT Press,DOI: 10.7551/mitpress/12350.001.0001,III THE DANGERS OF AI,Peter Dauvergne,,,,,
,IEEE,Publisher: MIT Press,DOI: 10.7551/mitpress/12350.001.0001,I THE GLOBAL POLITICAL ECONOMY OF AI,Peter Dauvergne,,,,,
,IEEE,Publisher: IET,,IEE Colloquium on 'AI in the User Interface' (Digest No.118),,,,,,
,IEEE,Publisher: IEEE,DOI: 10.1109/IC3SE62002.2024.10593585,Evaluation of the Explainable AI-NLP Framework for Text Categorization,Amar Preet Singh; Gaurav Gupta; Soumya K,,"Although there has been a decrease in interpretability, significant progress has lately been achieved in developing state-of-the-art models. This assessment provides a thorough analysis of Explainable AI (XAI) within the framework of Natural Language Processing (NLP). This study examines the fundamental classification of descriptions in addition to the many techniques for producing and displaying explanations. The purpose of the survey is to provide a comprehensive study of the many approaches and strategies used to clarify the models' predictions, making it a helpful tool for people who develop NLP models. Additionally, we draw attention to the gaps in the current literature and urge further investigation into potential avenues for this crucial field of study. An experiment is also conducted and the results are discussed in this article.",,,
